0000 Ether / IP / TCP 192.168.1.2:amt_blc_port > 212.204.214.114:6667 PA / IRCDetector / IRC
0001 Ether / IP / TCP 212.204.214.114:6667 > 192.168.1.2:amt_blc_port A
0002 Ether / IP / TCP 212.204.214.114:6667 > 192.168.1.2:amt_blc_port PA / IRCDetector / IRC
0003 Ether / IP / TCP 192.168.1.2:amt_blc_port > 212.204.214.114:6667 A
0004 Ether / IP / UDP / DNS Qry "2.1.168.192.in-addr.arpa." 
0005 Ether / IP / UDP / DNS Qry "114.214.204.212.in-addr.arpa." 
0006 Ether / IP / UDP / DNS Ans 
0007 Ether / IP / UDP / DNS Ans "sterling.freenode.net." 
0008 Ether / IP / UDP / DNS Qry "sterling.freenode.net." 
0009 Ether / IP / UDP / DNS Ans "212.204.214.114" 
0010 Ether / IP / UDP / DNS Qry "1.1.168.192.in-addr.arpa." 
0011 Ether / IP / UDP / DNS Ans "voyager.home." 
0012 Ether / IP / UDP / DNS Qry "voyager.home." 
0013 Ether / IP / UDP / DNS Ans "192.168.1.1" 
0014 Ether / IP / TCP 71.10.179.129:14232 > 192.168.1.2:as_debug PA / Raw
0015 Ether / IP / TCP 192.168.1.2:as_debug > 71.10.179.129:14232 A
0016 Ether / IP / TCP 192.168.1.2:as_debug > 71.10.179.129:14232 PA / IRCDetector / Raw
0017 Ether / IP / TCP 212.204.214.114:6667 > 192.168.1.2:amt_blc_port PA / IRCDetector / IRC
0018 Ether / IP / TCP 192.168.1.2:amt_blc_port > 212.204.214.114:6667 A
0019 Ether / IP / TCP 71.10.179.129:14232 > 192.168.1.2:as_debug A
0020 Ether / IP / UDP / DNS Qry "129.179.10.71.in-addr.arpa." 
0021 Ether / IP / UDP / DNS Ans "71-10-179-129.dhcp.stls.mo.charter.com." 
0022 Ether / IP / TCP 172.200.160.242:11352 > 192.168.1.2:4984 PA / IRCDetector / Raw
0023 Ether / IP / TCP 192.168.1.2:4984 > 172.200.160.242:11352 A
0024 Ether / IP / UDP / DNS Qry "242.160.200.172.in-addr.arpa." 
0025 Ether / IP / UDP / DNS Qry "71-10-179-129.dhcp.stls.mo.charter.com." 
0026 Ether / IP / UDP / DNS Ans "71.10.179.129" 
0027 Ether / IP / UDP / DNS Ans "ACC8A0F2.ipt.aol.com." 
0028 Ether / IP / UDP / DNS Qry "ACC8A0F2.ipt.aol.com." 
0029 Ether / IP / UDP / DNS Ans "172.200.160.242" 
0030 Ether / IP / TCP 212.204.214.114:6667 > 192.168.1.2:amt_blc_port PA / IRCDetector / IRC
0031 Ether / IP / TCP 192.168.1.2:amt_blc_port > 212.204.214.114:6667 A
0032 Ether / IP / TCP 212.204.214.114:6667 > 192.168.1.2:amt_blc_port PA / IRCDetector / IRC
0033 Ether / IP / TCP 192.168.1.2:amt_blc_port > 212.204.214.114:6667 A
0034 Ether / IP / TCP 71.10.179.129:14232 > 192.168.1.2:as_debug PA / Raw
0035 Ether / IP / TCP 192.168.1.2:as_debug > 71.10.179.129:14232 A
0036 00:04:76:96:7b:da > ff:ff:ff:ff:ff:ff (0x88a2) / Raw
0037 Ether / IP / TCP 86.128.100.24:hsrpv6 > 192.168.1.2:epmap S
0038 Ether / IP / TCP 192.168.1.2:epmap > 86.128.100.24:hsrpv6 RA
0039 Ether / IP / TCP 172.200.160.242:11352 > 192.168.1.2:4984 PA / IRCDetector / Raw
0040 Ether / IP / TCP 192.168.1.2:4984 > 172.200.160.242:11352 A
0041 Ether / IP / UDP / DNS Qry "24.100.128.86.in-addr.arpa." 
0042 Ether / IP / UDP / DNS Ans "host86-128-100-24.range86-128.btcentralplus.com." 
0043 Ether / IP / TCP 192.168.1.2:4984 > 172.200.160.242:11352 PA / IRCDetector / Raw
0044 Ether / IP / TCP 172.200.160.242:11352 > 192.168.1.2:4984 A
0045 Ether / IP / TCP 68.95.198.126:emsd_port > 192.168.1.2:vsixml PA / IRCDetector / Raw
0046 Ether / IP / TCP 192.168.1.2:vsixml > 68.95.198.126:emsd_port A
0047 Ether / IP / UDP / DNS Qry "host86-128-100-24.range86-128.btcentralplus.com." 
0048 Ether / IP / UDP / DNS Ans "86.128.100.24" 
0049 Ether / IP / TCP 86.128.187.110:objadmin > 192.168.1.2:netbios_ssn S
0050 Ether / IP / TCP 192.168.1.2:netbios_ssn > 86.128.187.110:objadmin RA
0051 Ether / IP / TCP 24.177.122.79:oa_system > 192.168.1.2:asap_tcp PA / IRCDetector / Raw
0052 Ether / IP / TCP 192.168.1.2:asap_tcp > 24.177.122.79:oa_system A
0053 Ether / IP / TCP 192.168.1.2:asap_tcp > 24.177.122.79:oa_system PA / IRCDetector / Raw
0054 Ether / IP / TCP 24.177.122.79:oa_system > 192.168.1.2:asap_tcp A
0055 Ether / IP / TCP 212.204.214.114:6667 > 192.168.1.2:amt_blc_port PA / IRCDetector / IRC
0056 Ether / IP / TCP 192.168.1.2:amt_blc_port > 212.204.214.114:6667 A
0057 Ether / IP / UDP / DNS Qry "126.198.95.68.in-addr.arpa." 
0058 Ether / IP / UDP / DNS Qry "110.187.128.86.in-addr.arpa." 
0059 Ether / IP / UDP / DNS Qry "79.122.177.24.in-addr.arpa." 
0060 Ether / IP / UDP / DNS Ans "host86-128-187-110.range86-128.btcentralplus.com." 
0061 Ether / IP / UDP / DNS Ans "adsl-68-95-198-126.dsl.wlfrct.sbcglobal.net." 
0062 Ether / IP / UDP / DNS Ans "24-177-122-79.dhcp.mdsn.wi.charter.com." 
0063 Ether / IP / TCP 192.168.1.2:amt_blc_port > 212.204.214.114:6667 PA / IRCDetector / IRC
0064 Ether / IP / TCP 212.204.214.114:6667 > 192.168.1.2:amt_blc_port A
0065 Ether / IP / TCP 212.204.214.114:6667 > 192.168.1.2:amt_blc_port PA / IRCDetector / IRC / IRC / IRC / IRC / IRC / IRC / IRC / IRC
0066 Ether / IP / TCP 192.168.1.2:amt_blc_port > 212.204.214.114:6667 A
0067 Ether / IP / TCP 212.204.214.114:6667 > 192.168.1.2:amt_blc_port PA / IRCDetector / Raw
0068 Ether / IP / TCP 192.168.1.2:amt_blc_port > 212.204.214.114:6667 A
0069 Ether / IP / UDP / DNS Qry "host86-128-187-110.range86-128.btcentralplus.com." 
0070 Ether / IP / UDP / DNS Qry "adsl-68-95-198-126.dsl.wlfrct.sbcglobal.net." 
0071 Ether / IP / UDP / DNS Qry "24-177-122-79.dhcp.mdsn.wi.charter.com." 
0072 Ether / IP / UDP / DNS Ans "86.128.187.110" 
0073 Ether / IP / UDP / DNS Ans "68.95.198.126" 
0074 Ether / IP / UDP / DNS Ans "24.177.122.79" 
0075 Ether / IP / TCP 212.204.214.114:6667 > 192.168.1.2:amt_blc_port PA / IRCDetector / IRC
0076 Ether / IP / TCP 192.168.1.2:amt_blc_port > 212.204.214.114:6667 A
0077 Ether / IP / TCP 172.200.160.242:11352 > 192.168.1.2:4984 PA / IRCDetector / Raw
0078 Ether / IP / TCP 192.168.1.2:4984 > 172.200.160.242:11352 A
0079 Ether / IP / TCP 86.128.187.110:objadmin > 192.168.1.2:netbios_ssn S
0080 Ether / IP / TCP 192.168.1.2:netbios_ssn > 86.128.187.110:objadmin RA
0081 Ether / IP / TCP 192.168.1.2:amt_blc_port > 212.204.214.114:6667 PA / IRCDetector / IRC
0082 Ether / IP / TCP 212.204.214.114:6667 > 192.168.1.2:amt_blc_port PA / IRCDetector / IRC
0083 Ether / IP / TCP 192.168.1.2:amt_blc_port > 212.204.214.114:6667 A
0084 Ether / IP / TCP 71.10.179.129:14232 > 192.168.1.2:as_debug PA / IRCDetector / Raw
0085 Ether / IP / TCP 192.168.1.2:as_debug > 71.10.179.129:14232 A
0086 Ether / IP / TCP 192.168.1.2:watcomdebug > 68.32.70.119:scanstat_1 PA / IRCDetector / Raw
0087 Ether / IP / TCP 68.32.70.119:scanstat_1 > 192.168.1.2:watcomdebug PA / Raw
0088 Ether / IP / TCP 192.168.1.2:watcomdebug > 68.32.70.119:scanstat_1 PA / IRCDetector / Raw
0089 Ether / IP / TCP 172.200.160.242:11352 > 192.168.1.2:4984 PA / IRCDetector / Raw
0090 Ether / IP / TCP 192.168.1.2:4984 > 172.200.160.242:11352 A
0091 Ether / IP / UDP / DNS Qry "119.70.32.68.in-addr.arpa." 
0092 Ether / IP / TCP 68.32.70.119:scanstat_1 > 192.168.1.2:watcomdebug PA / Raw
0093 Ether / IP / TCP 192.168.1.2:watcomdebug > 68.32.70.119:scanstat_1 A
0094 Ether / IP / UDP / DNS Ans "c-68-32-70-119.hsd1.ga.comcast.net." 
0095 Ether / IP / UDP / DNS Qry "c-68-32-70-119.hsd1.ga.comcast.net." 
0096 Ether / IP / UDP / DNS Ans "68.32.70.119" 
0097 Ether / IP / TCP 192.168.1.2:as_debug > 71.10.179.129:14232 PA / IRCDetector / Raw
0098 Ether / IP / TCP 192.168.1.2:4984 > 172.200.160.242:11352 PA / IRCDetector / Raw
0099 Ether / IP / TCP 192.168.1.2:asap_tcp > 24.177.122.79:oa_system PA / IRCDetector / Raw
0100 Ether / IP / TCP 172.200.160.242:11352 > 192.168.1.2:4984 A
0101 Ether / IP / TCP 24.177.122.79:oa_system > 192.168.1.2:asap_tcp A
0102 Ether / IP / TCP 71.10.179.129:14232 > 192.168.1.2:as_debug A
0103 Ether / IP / TCP 212.204.214.114:6667 > 192.168.1.2:amt_blc_port PA / IRCDetector / IRC
0104 Ether / IP / TCP 192.168.1.2:amt_blc_port > 212.204.214.114:6667 A
0105 Ether / IP / TCP 212.204.214.114:6667 > 192.168.1.2:amt_blc_port PA / IRCDetector / IRC
0106 Ether / IP / TCP 192.168.1.2:amt_blc_port > 212.204.214.114:6667 A
0107 Ether / IP / TCP 71.10.179.129:14232 > 192.168.1.2:as_debug PA / IRCDetector / Raw
0108 Ether / IP / TCP 192.168.1.2:as_debug > 71.10.179.129:14232 A
0109 Ether / IP / TCP 24.177.122.79:oa_system > 192.168.1.2:asap_tcp PA / IRCDetector / Raw
0110 Ether / IP / TCP 192.168.1.2:asap_tcp > 24.177.122.79:oa_system A
0111 Ether / IP / TCP 212.204.214.114:6667 > 192.168.1.2:amt_blc_port PA / IRCDetector / IRC
0112 Ether / IP / TCP 192.168.1.2:amt_blc_port > 212.204.214.114:6667 A
0113 Ether / IP / TCP 192.168.1.2:vsixml > 68.95.198.126:emsd_port PA / IRCDetector / Raw
0114 Ether / IP / TCP 68.95.198.126:emsd_port > 192.168.1.2:vsixml PA / IRCDetector / Raw
0115 Ether / IP / TCP 192.168.1.2:vsixml > 68.95.198.126:emsd_port A
0116 Ether / IP / TCP 192.168.1.2:amt_blc_port > 212.204.214.114:6667 PA / IRCDetector / IRC
0117 Ether / IP / TCP 212.204.214.114:6667 > 192.168.1.2:amt_blc_port A
0118 Ether / IP / TCP 212.204.214.114:6667 > 192.168.1.2:amt_blc_port PA / IRCDetector / IRC / IRC / IRC / IRC / IRC / IRC / IRC / IRC
0119 Ether / IP / TCP 192.168.1.2:amt_blc_port > 212.204.214.114:6667 A
0120 Ether / IP / TCP 212.204.214.114:6667 > 192.168.1.2:amt_blc_port A / IRCDetector / Raw
0121 Ether / IP / TCP 192.168.1.2:amt_blc_port > 212.204.214.114:6667 A
0122 Ether / IP / TCP 212.204.214.114:6667 > 192.168.1.2:amt_blc_port A / IRCDetector / Raw
0123 Ether / IP / TCP 192.168.1.2:amt_blc_port > 212.204.214.114:6667 A
0124 Ether / IP / TCP 212.204.214.114:6667 > 192.168.1.2:amt_blc_port A / Raw
0125 Ether / IP / TCP 192.168.1.2:amt_blc_port > 212.204.214.114:6667 A
0126 Ether / IP / TCP 212.204.214.114:6667 > 192.168.1.2:amt_blc_port A / IRCDetector / Raw
0127 Ether / IP / TCP 192.168.1.2:amt_blc_port > 212.204.214.114:6667 A
0128 Ether / IP / TCP 212.204.214.114:6667 > 192.168.1.2:amt_blc_port A / IRCDetector / Raw
0129 Ether / IP / TCP 192.168.1.2:amt_blc_port > 212.204.214.114:6667 A
0130 Ether / IP / TCP 212.204.214.114:6667 > 192.168.1.2:amt_blc_port A / IRCDetector / Raw
0131 Ether / IP / TCP 192.168.1.2:amt_blc_port > 212.204.214.114:6667 A
0132 Ether / IP / TCP 212.204.214.114:6667 > 192.168.1.2:amt_blc_port A / IRCDetector / Raw
0133 Ether / IP / TCP 192.168.1.2:amt_blc_port > 212.204.214.114:6667 A
0134 Ether / IP / TCP 212.204.214.114:6667 > 192.168.1.2:amt_blc_port A / IRCDetector / Raw
0135 Ether / IP / TCP 192.168.1.2:amt_blc_port > 212.204.214.114:6667 A
0136 Ether / IP / TCP 212.204.214.114:6667 > 192.168.1.2:amt_blc_port A / IRCDetector / Raw
0137 Ether / IP / TCP 192.168.1.2:amt_blc_port > 212.204.214.114:6667 A
0138 Ether / IP / TCP 212.204.214.114:6667 > 192.168.1.2:amt_blc_port A / IRCDetector / Raw
0139 Ether / IP / TCP 192.168.1.2:amt_blc_port > 212.204.214.114:6667 A
0140 Ether / IP / TCP 212.204.214.114:6667 > 192.168.1.2:amt_blc_port A / IRCDetector / Raw
0141 Ether / IP / TCP 192.168.1.2:amt_blc_port > 212.204.214.114:6667 A
0142 Ether / IP / TCP 212.204.214.114:6667 > 192.168.1.2:amt_blc_port A / IRCDetector / Raw
0143 Ether / IP / TCP 192.168.1.2:amt_blc_port > 212.204.214.114:6667 A
0144 Ether / IP / TCP 212.204.214.114:6667 > 192.168.1.2:amt_blc_port A / IRCDetector / Raw
0145 Ether / IP / TCP 192.168.1.2:amt_blc_port > 212.204.214.114:6667 A
0146 Ether / IP / TCP 212.204.214.114:6667 > 192.168.1.2:amt_blc_port A / IRCDetector / Raw
0147 Ether / IP / TCP 192.168.1.2:amt_blc_port > 212.204.214.114:6667 A
0148 Ether / IP / TCP 212.204.214.114:6667 > 192.168.1.2:amt_blc_port PA / IRCDetector / Raw
0149 Ether / IP / TCP 192.168.1.2:amt_blc_port > 212.204.214.114:6667 A
0150 Ether / IP / TCP 192.168.1.2:amt_blc_port > 212.204.214.114:6667 PA / IRCDetector / IRC
0151 Ether / IP / TCP 212.204.214.114:6667 > 192.168.1.2:amt_blc_port PA / IRCDetector / IRC
0152 Ether / IP / TCP 192.168.1.2:amt_blc_port > 212.204.214.114:6667 A
0153 Ether / IP / TCP 172.200.160.242:11352 > 192.168.1.2:4984 PA / IRCDetector / Raw
0154 Ether / IP / TCP 192.168.1.2:4984 > 172.200.160.242:11352 A
0155 Ether / IP / TCP 212.204.214.114:6667 > 192.168.1.2:amt_blc_port PA / IRCDetector / IRC
0156 Ether / IP / TCP 192.168.1.2:amt_blc_port > 212.204.214.114:6667 A
0157 Ether / IP / TCP 212.204.214.114:6667 > 192.168.1.2:amt_blc_port PA / IRCDetector / IRC
0158 Ether / IP / TCP 192.168.1.2:amt_blc_port > 212.204.214.114:6667 A
0159 Ether / IP / TCP 71.10.179.129:14232 > 192.168.1.2:as_debug PA / Raw
0160 Ether / IP / TCP 192.168.1.2:as_debug > 71.10.179.129:14232 A
0161 Ether / IP / TCP 71.10.179.129:14232 > 192.168.1.2:as_debug PA / IRCDetector / Raw
0162 Ether / IP / TCP 192.168.1.2:as_debug > 71.10.179.129:14232 A
0163 Ether / IP / TCP 192.168.1.2:as_debug > 71.10.179.129:14232 PA / Raw
0164 Ether / IP / TCP 71.10.179.129:14232 > 192.168.1.2:as_debug A
0165 Ether / IP / TCP 172.200.160.242:11352 > 192.168.1.2:4984 PA / Raw
0166 Ether / IP / TCP 192.168.1.2:4984 > 172.200.160.242:11352 A
0167 Ether / IP / TCP 172.200.160.242:11352 > 192.168.1.2:4984 PA / IRCDetector / Raw
0168 Ether / IP / TCP 192.168.1.2:4984 > 172.200.160.242:11352 A
0169 Ether / IP / TCP 71.10.179.129:14232 > 192.168.1.2:as_debug PA / Raw
0170 Ether / IP / TCP 192.168.1.2:as_debug > 71.10.179.129:14232 A
0171 Ether / IP / TCP 192.168.1.2:4984 > 172.200.160.242:11352 PA / IRCDetector / Raw
0172 Ether / IP / TCP 172.200.160.242:11352 > 192.168.1.2:4984 A
0173 Ether / ARP who has 192.168.1.2 says 192.168.1.1 / Padding
0174 Ether / ARP is at 00:04:76:96:7b:da says 192.168.1.2
0175 Ether / IP / UDP 192.168.1.2:35990 > 86.197.95.238:44019 / Raw
0176 Ether / IP / UDP / DNS Qry "238.95.197.86.in-addr.arpa." 
0177 Ether / IP / UDP / DNS Ans "AMarseille-253-1-68-238.w86-197.abo.wanadoo.fr." 
0178 Ether / IP / TCP 192.168.1.2:amt_blc_port > 212.204.214.114:6667 PA / IRCDetector / IRC
0179 Ether / IP / TCP 212.204.214.114:6667 > 192.168.1.2:amt_blc_port PA / IRCDetector / IRC
0180 Ether / IP / TCP 192.168.1.2:amt_blc_port > 212.204.214.114:6667 A
0181 Ether / IP / UDP / DNS Qry "AMarseille-253-1-68-238.w86-197.abo.wanadoo.fr." 
0182 Ether / IP / UDP / DNS Ans "86.197.95.238" 
0183 Ether / IP / UDP 192.168.1.2:35990 > 86.31.70.81:43870 / Raw
0184 Ether / IP / UDP 192.168.1.2:35990 > 86.220.100.25:elan / Raw
0185 Ether / IP / UDP 192.168.1.2:35990 > 86.130.63.111:12505 / Raw
0186 Ether / IP / UDP 192.168.1.2:35990 > 80.216.195.140:miva_mqs / Raw
0187 Ether / IP / TCP 24.177.122.79:oa_system > 192.168.1.2:asap_tcp PA / IRCDetector / Raw
0188 Ether / IP / TCP 192.168.1.2:asap_tcp > 24.177.122.79:oa_system A
0189 Ether / IP / TCP 192.168.1.2:asap_tcp > 24.177.122.79:oa_system PA / IRCDetector / Raw
0190 Ether / IP / UDP / DNS Qry "81.70.31.86.in-addr.arpa." 
0191 Ether / IP / UDP / DNS Qry "25.100.220.86.in-addr.arpa." 
0192 Ether / IP / UDP / DNS Qry "111.63.130.86.in-addr.arpa." 
0193 Ether / IP / UDP / DNS Qry "140.195.216.80.in-addr.arpa." 
0194 Ether / IP / UDP / DNS Ans "client-86-31-70-81.midd.adsl.virgin.net." 
0195 Ether / IP / UDP / DNS Ans "host86-130-63-111.range86-130.btcentralplus.com." 
0196 Ether / IP / UDP / DNS Ans "AOrleans-257-1-93-25.w86-220.abo.wanadoo.fr." 
0197 Ether / IP / UDP / DNS Ans "c80-216-195-140.cm-upc.chello.se." 
0198 Ether / IP / TCP 24.177.122.79:oa_system > 192.168.1.2:asap_tcp A
0199 Ether / IP / UDP / DNS Qry "client-86-31-70-81.midd.adsl.virgin.net." 
0200 Ether / IP / UDP / DNS Qry "host86-130-63-111.range86-130.btcentralplus.com." 
0201 Ether / IP / UDP / DNS Qry "AOrleans-257-1-93-25.w86-220.abo.wanadoo.fr." 
0202 Ether / IP / UDP / DNS Qry "c80-216-195-140.cm-upc.chello.se." 
0203 Ether / IP / UDP / DNS Ans "86.31.70.81" 
0204 Ether / IP / UDP / DNS Ans "86.130.63.111" 
0205 Ether / IP / UDP / DNS Ans "86.220.100.25" 
0206 Ether / IP / UDP / DNS Ans "80.216.195.140" 
0207 Ether / IP / TCP 212.204.214.114:6667 > 192.168.1.2:amt_blc_port PA / IRCDetector / IRC
0208 Ether / IP / TCP 192.168.1.2:amt_blc_port > 212.204.214.114:6667 A
0209 Ether / IP / TCP 24.177.122.79:oa_system > 192.168.1.2:asap_tcp PA / Raw
0210 Ether / IP / TCP 192.168.1.2:asap_tcp > 24.177.122.79:oa_system A
0211 Ether / IP / TCP 65.190.6.124:47452 > 192.168.1.2:ssc_agent PA / Raw
0212 Ether / IP / TCP 192.168.1.2:ssc_agent > 65.190.6.124:47452 A
0213 Ether / IP / UDP 192.168.1.2:35990 > 165.124.253.241:15294 / Raw
0214 Ether / IP / UDP 165.124.253.241:15294 > 192.168.1.2:35990 / Raw / Padding
0215 Ether / IP / UDP 192.168.1.2:35990 > 165.124.253.241:15294 / Raw
0216 Ether / IP / UDP / DNS Qry "124.6.190.65.in-addr.arpa." 
0217 Ether / IP / UDP / DNS Qry "241.253.124.165.in-addr.arpa." 
0218 Ether / IP / UDP 165.124.253.241:15294 > 192.168.1.2:35990 / Raw
0219 Ether / IP / UDP 192.168.1.2:35990 > 81.236.228.111:42764 / Raw
0220 Ether / IP / UDP 81.236.228.111:42764 > 192.168.1.2:35990 / Raw
0221 Ether / IP / UDP 192.168.1.2:35990 > 86.142.117.124:36474 / Raw
0222 Ether / IP / UDP / DNS Ans "cpe-065-190-006-124.triad.res.rr.com." 
0223 Ether / IP / UDP / DNS Ans "engmanlab10.pathology.northwestern.edu." 
0224 Ether / IP / UDP / DNS Qry "cpe-065-190-006-124.triad.res.rr.com." 
0225 Ether / IP / UDP / DNS Qry "engmanlab10.pathology.northwestern.edu." 
0226 Ether / IP / UDP / DNS Ans "65.190.6.124" 
0227 Ether / IP / UDP / DNS Ans "165.124.253.241" 
0228 Ether / IP / UDP 192.168.1.2:35990 > 86.142.178.222:12881 / Raw
0229 Ether / IP / UDP 192.168.1.2:35990 > 86.128.163.125:25906 / Raw
0230 Ether / IP / UDP 192.168.1.2:35990 > 86.134.79.66:denali_server / Raw
0231 Ether / IP / UDP 192.168.1.2:35990 > 86.136.192.70:16329 / Raw
0232 Ether / IP / ICMP 86.128.163.125 > 192.168.1.2 dest-unreach port-unreachable / IPerror / UDPerror
0233 Ether / IP / ICMP 86.134.79.66 > 192.168.1.2 dest-unreach port-unreachable / IPerror / UDPerror
0234 Ether / IP / TCP 172.200.160.242:11352 > 192.168.1.2:4984 PA / IRCDetector / Raw
0235 Ether / IP / TCP 192.168.1.2:4984 > 172.200.160.242:11352 A
0236 Ether / IP / TCP 71.10.179.129:14232 > 192.168.1.2:as_debug PA / IRCDetector / Raw
0237 Ether / IP / TCP 192.168.1.2:as_debug > 71.10.179.129:14232 A
0238 00:04:76:96:7b:da > ff:ff:ff:ff:ff:ff (0x88a2) / Raw
0239 Ether / IP / UDP / DNS Qry "111.228.236.81.in-addr.arpa." 
0240 Ether / IP / UDP / DNS Qry "124.117.142.86.in-addr.arpa." 
0241 Ether / IP / UDP / DNS Qry "222.178.142.86.in-addr.arpa." 
0242 Ether / IP / UDP / DNS Qry "125.163.128.86.in-addr.arpa." 
0243 Ether / IP / UDP / DNS Qry "66.79.134.86.in-addr.arpa." 
0244 Ether / IP / UDP / DNS Qry "70.192.136.86.in-addr.arpa." 
0245 Ether / IP / UDP / DNS Ans "host86-142-117-124.range86-142.btcentralplus.com." 
0246 Ether / IP / UDP / DNS Ans "host86-142-178-222.range86-142.btcentralplus.com." 
0247 Ether / IP / UDP / DNS Ans "host86-128-163-125.range86-128.btcentralplus.com." 
0248 Ether / IP / UDP / DNS Ans "81-236-228-111-no37.tbcn.telia.com." 
0249 Ether / IP / UDP / DNS Ans "host86-134-79-66.range86-134.btcentralplus.com." 
0250 Ether / IP / UDP / DNS Ans "host86-136-192-70.range86-136.btcentralplus.com." 
0251 Ether / IP / UDP / DNS Qry "host86-142-117-124.range86-142.btcentralplus.com." 
0252 Ether / IP / UDP / DNS Qry "host86-142-178-222.range86-142.btcentralplus.com." 
0253 Ether / IP / UDP / DNS Qry "host86-128-163-125.range86-128.btcentralplus.com." 
0254 Ether / IP / UDP / DNS Qry "81-236-228-111-no37.tbcn.telia.com." 
0255 Ether / IP / UDP / DNS Qry "host86-134-79-66.range86-134.btcentralplus.com." 
0256 Ether / IP / UDP / DNS Qry "host86-136-192-70.range86-136.btcentralplus.com." 
0257 Ether / IP / UDP / DNS Ans "86.142.117.124" 
0258 Ether / IP / UDP / DNS Ans "86.142.178.222" 
0259 Ether / IP / UDP / DNS Ans "86.128.163.125" 
0260 Ether / IP / UDP / DNS Ans "81.236.228.111" 
0261 Ether / IP / UDP / DNS Ans "86.134.79.66" 
0262 Ether / IP / UDP / DNS Ans "86.136.192.70" 
0263 Ether / IP / UDP 192.168.1.2:35990 > 80.186.57.176:8788 / Raw
0264 Ether / IP / UDP 80.186.57.176:8788 > 192.168.1.2:35990 / Raw
0265 Ether / IP / UDP 192.168.1.2:35990 > 68.206.150.243:57322 / Raw
0266 Ether / IP / UDP 68.206.150.243:57322 > 192.168.1.2:35990 / Raw
0267 Ether / IP / TCP 192.168.1.2:sti_envision > 68.206.150.243:57322 S
0268 Ether / IP / UDP 192.168.1.2:35990 > 82.128.194.105:60142 / Raw
0269 Ether / IP / ICMP 212.50.132.237 > 192.168.1.2 time-exceeded ttl-zero-during-transit / IPerror / UDPerror
0270 Ether / IP / TCP 68.206.150.243:57322 > 192.168.1.2:sti_envision SA
0271 Ether / IP / TCP 192.168.1.2:sti_envision > 68.206.150.243:57322 A
0272 Ether / IP / TCP 192.168.1.2:sti_envision > 68.206.150.243:57322 PA / Raw
0273 Ether / IP / TCP 68.206.150.243:57322 > 192.168.1.2:sti_envision PA / IRCDetector / Raw
0274 Ether / IP / TCP 192.168.1.2:sti_envision > 68.206.150.243:57322 A
0275 Ether / IP / TCP 192.168.1.2:sti_envision > 68.206.150.243:57322 PA / Raw
0276 Ether / IP / TCP 68.206.150.243:57322 > 192.168.1.2:sti_envision PA / Raw
0277 Ether / IP / TCP 192.168.1.2:sti_envision > 68.206.150.243:57322 PA / IRCDetector / Raw
0278 Ether / IP / TCP 68.206.150.243:57322 > 192.168.1.2:sti_envision PA / Raw
0279 Ether / IP / TCP 192.168.1.2:sti_envision > 68.206.150.243:57322 A
0280 Ether / IP / UDP / DNS Qry "176.57.186.80.in-addr.arpa." 
0281 Ether / IP / UDP / DNS Qry "243.150.206.68.in-addr.arpa." 
0282 Ether / IP / UDP / DNS Ans "a80-186-57-176.elisa-laajakaista.fi." 
0283 Ether / IP / TCP 192.168.1.2:sti_envision > 68.206.150.243:57322 PA / IRCDetector / Raw
0284 Ether / IP / UDP 192.168.1.2:60577 > 204.152.205.205:33435 / Raw
0285 Ether / IP / UDP / DNS Ans "cpe-68-206-150-243.hot.res.rr.com." 
0286 Ether / IP / ICMP 217.47.73.141 > 192.168.1.2 time-exceeded ttl-zero-during-transit / IPerror / UDPerror
0287 Ether / IP / TCP 68.206.150.243:57322 > 192.168.1.2:sti_envision PA / Raw
0288 Ether / IP / TCP 192.168.1.2:sti_envision > 68.206.150.243:57322 PA / Raw
0289 Ether / IP / TCP 68.206.150.243:57322 > 192.168.1.2:sti_envision PA / IRCDetector / Raw
0290 Ether / IP / TCP 192.168.1.2:sti_envision > 68.206.150.243:57322 A
0291 Ether / IP / TCP 192.168.1.2:dx_instrument > 195.215.8.141:33033 S
0292 Ether / IP / TCP 195.215.8.141:33033 > 192.168.1.2:dx_instrument SA
0293 Ether / IP / TCP 192.168.1.2:dx_instrument > 195.215.8.141:33033 A
0294 Ether / IP / UDP 192.168.1.2:35990 > 83.147.171.206:6293 / Raw
0295 Ether / IP / UDP 192.168.1.2:35990 > 172.207.190.217:51361 / Raw
0296 Ether / IP / TCP 192.168.1.2:dx_instrument > 195.215.8.141:33033 PA / IRCDetector / Raw
0297 Ether / IP / UDP / DNS Qry "105.194.128.82.in-addr.arpa." 
0298 Ether / IP / UDP / DNS Qry "a80-186-57-176.elisa-laajakaista.fi." 
0299 Ether / IP / UDP / DNS Qry "cpe-68-206-150-243.hot.res.rr.com." 
0300 Ether / IP / UDP / DNS Qry "237.132.50.212.in-addr.arpa." 
0301 Ether / IP / UDP / DNS Qry "205.205.152.204.in-addr.arpa." 
0302 Ether / IP / UDP / DNS Qry "141.73.47.217.in-addr.arpa." 
0303 Ether / IP / UDP / DNS Ans "80.186.57.176" 
0304 Ether / IP / UDP / DNS Ans "68.206.150.243" 
0305 Ether / IP / UDP 83.147.171.206:6293 > 192.168.1.2:35990 / Raw
0306 Ether / IP / UDP 192.168.1.2:35990 > 190.44.165.86:57549 / Raw
0307 Ether / IP / UDP 192.168.1.2:35990 > 83.130.238.168:26744 / Raw
0308 Ether / IP / UDP 192.168.1.2:35990 > 83.5.146.219:aspen_services / Raw
0309 Ether / IP / UDP 192.168.1.2:35990 > 82.253.163.244:38930 / Raw
0310 Ether / IP / TCP 195.215.8.141:33033 > 192.168.1.2:dx_instrument A
0311 Ether / IP / UDP / DNS Ans "esr2.sheffield3.broadband.bt.net." 
0312 Ether / IP / UDP 172.207.190.217:51361 > 192.168.1.2:35990 / Raw
0313 Ether / IP / TCP 195.215.8.141:33033 > 192.168.1.2:dx_instrument PA / IRCDetector / Raw
0314 Ether / IP / TCP 192.168.1.2:dx_instrument > 195.215.8.141:33033 A
0315 Ether / IP / TCP 192.168.1.2:dx_instrument > 195.215.8.141:33033 PA / Raw
0316 Ether / IP / UDP / DNS Ans "Torik16-TR1-82-128-194-105.suomi.net." 
0317 Ether / IP / UDP / DNS Ans "Torik16R1.opoy.net." 
0318 Ether / IP / UDP 192.168.1.2:60582 > 202.139.177.147:33435 / Raw
0319 Ether / IP / UDP 192.168.1.2:60583 > 202.232.205.123:33435 / Raw
0320 Ether / IP / UDP 192.168.1.2:60579 > 130.244.145.31:33435 / Raw
0321 Ether / IP / UDP 192.168.1.2:60577 > 204.152.205.205:33436 / Raw
0322 Ether / IP / ICMP 217.47.73.141 > 192.168.1.2 time-exceeded ttl-zero-during-transit / IPerror / UDPerror
0323 Ether / IP / UDP 192.168.1.2:60582 > 202.139.177.147:33436 / Raw
0324 Ether / IP / ICMP 217.47.73.141 > 192.168.1.2 time-exceeded ttl-zero-during-transit / IPerror / UDPerror
0325 Ether / IP / UDP 192.168.1.2:60583 > 202.232.205.123:33436 / Raw
0326 Ether / IP / ICMP 217.47.73.141 > 192.168.1.2 time-exceeded ttl-zero-during-transit / IPerror / UDPerror
0327 Ether / IP / UDP 192.168.1.2:60579 > 130.244.145.31:33436 / Raw
0328 Ether / IP / ICMP 217.47.73.30 > 192.168.1.2 time-exceeded ttl-zero-during-transit / IPerror / UDPerror
0329 Ether / IP / UDP 192.168.1.2:60577 > 204.152.205.205:33437 / Raw
0330 Ether / IP / ICMP 217.47.73.30 > 192.168.1.2 time-exceeded ttl-zero-during-transit / IPerror / UDPerror
0331 Ether / IP / UDP / DNS Ans 
0332 Ether / IP / UDP 82.253.163.244:38930 > 192.168.1.2:35990 / Raw
0333 Ether / IP / ICMP 217.47.73.30 > 192.168.1.2 time-exceeded ttl-zero-during-transit / IPerror / UDPerror
0334 Ether / IP / ICMP 217.47.73.30 > 192.168.1.2 time-exceeded ttl-zero-during-transit / IPerror / UDPerror
0335 Ether / IP / ICMP 217.41.176.21 > 192.168.1.2 time-exceeded ttl-zero-during-transit / IPerror / UDPerror
0336 Ether / IP / UDP 192.168.1.2:60577 > 204.152.205.205:33438 / Raw
0337 Ether / IP / UDP 83.130.238.168:26744 > 192.168.1.2:35990 / Raw
0338 Ether / IP / UDP 192.168.1.2:35990 > 83.130.238.168:26744 / Raw
0339 Ether / IP / ICMP 217.41.176.118 > 192.168.1.2 time-exceeded ttl-zero-during-transit / IPerror / UDPerror
0340 Ether / IP / TCP 195.215.8.141:33033 > 192.168.1.2:dx_instrument A
0341 Ether / IP / UDP 192.168.1.2:60579 > 130.244.145.31:33437 / Raw
0342 Ether / IP / UDP 192.168.1.2:60583 > 202.232.205.123:33437 / Raw
0343 Ether / IP / UDP 192.168.1.2:60582 > 202.139.177.147:33437 / Raw
0344 Ether / IP / ICMP 217.41.176.21 > 192.168.1.2 time-exceeded ttl-zero-during-transit / IPerror / UDPerror
0345 Ether / IP / UDP 192.168.1.2:60579 > 130.244.145.31:33438 / Raw
0346 Ether / IP / ICMP 217.41.176.21 > 192.168.1.2 time-exceeded ttl-zero-during-transit / IPerror / UDPerror
0347 Ether / IP / UDP 192.168.1.2:60583 > 202.232.205.123:33438 / Raw
0348 Ether / IP / ICMP 217.41.176.21 > 192.168.1.2 time-exceeded ttl-zero-during-transit / IPerror / UDPerror
0349 Ether / IP / UDP 192.168.1.2:60582 > 202.139.177.147:33438 / Raw
0350 Ether / IP / ICMP 217.41.176.118 > 192.168.1.2 time-exceeded ttl-zero-during-transit / IPerror / UDPerror
0351 Ether / IP / ICMP 217.41.176.118 > 192.168.1.2 time-exceeded ttl-zero-during-transit / IPerror / UDPerror
0352 Ether / IP / ICMP 217.41.176.118 > 192.168.1.2 time-exceeded ttl-zero-during-transit / IPerror / UDPerror
0353 Ether / IP / UDP 83.130.238.168:26744 > 192.168.1.2:35990 / Raw
0354 Ether / IP / UDP 192.168.1.2:35990 > 83.130.238.168:26744 / Raw
0355 Ether / IP / UDP 190.44.165.86:57549 > 192.168.1.2:35990 / Raw
0356 Ether / IP / UDP 192.168.1.2:35990 > 190.44.165.86:57549 / Raw
0357 Ether / IP / UDP 192.168.1.2:60586 > 217.41.176.118:33435 / Raw
0358 Ether / IP / UDP 83.130.238.168:26744 > 192.168.1.2:35990 / Raw
0359 Ether / IP / UDP 192.168.1.2:35990 > 83.130.238.168:26744 / Raw
0360 Ether / IP / TCP 195.215.8.141:33033 > 192.168.1.2:dx_instrument PA / Raw
0361 Ether / IP / TCP 192.168.1.2:dx_instrument > 195.215.8.141:33033 PA / Raw
0362 Ether / IP / UDP 192.168.1.2:35990 > 212.72.49.142:12350 / Raw
0363 Ether / IP / TCP 192.168.1.2:sti_envision > 68.206.150.243:57322 PA / Raw
0364 Ether / IP / UDP 83.130.238.168:26744 > 192.168.1.2:35990 / Raw
0365 Ether / IP / UDP 192.168.1.2:35990 > 83.130.238.168:26744 / Raw
0366 Ether / IP / TCP 195.215.8.141:33033 > 192.168.1.2:dx_instrument A
0367 Ether / IP / UDP 212.72.49.142:12350 > 192.168.1.2:35990 / Raw
0368 Ether / IP / TCP 195.215.8.141:33033 > 192.168.1.2:dx_instrument PA / IRCDetector / Raw
0369 Ether / IP / TCP 68.206.150.243:57322 > 192.168.1.2:sti_envision PA / Raw
0370 Ether / IP / TCP 192.168.1.2:sti_envision > 68.206.150.243:57322 A
0371 Ether / IP / UDP 192.168.1.2:35990 > 212.149.248.49:62738 / Raw
0372 Ether / IP / UDP 192.168.1.2:35990 > 67.190.60.125:sops / Raw
0373 Ether / IP / UDP 192.168.1.2:35990 > 24.242.109.92:44872 / Raw
0374 Ether / IP / TCP 192.168.1.2:dx_instrument > 195.215.8.141:33033 A
0375 Ether / IP / UDP 83.130.238.168:26744 > 192.168.1.2:35990 / Raw
0376 Ether / IP / UDP 190.44.165.86:57549 > 192.168.1.2:35990 / Raw
0377 Ether / IP / UDP 192.168.1.2:35990 > 190.44.165.86:57549 / Raw
0378 Ether / IP / UDP 24.242.109.92:44872 > 192.168.1.2:35990 / Raw
0379 Ether / IP / TCP 192.168.1.2:sti_envision > 68.206.150.243:57322 PA / IRCDetector / Raw
0380 Ether / IP / UDP 67.190.60.125:sops > 192.168.1.2:35990 / Raw
0381 Ether / IP / TCP 68.206.150.243:57322 > 192.168.1.2:sti_envision PA / IRCDetector / Raw
0382 Ether / IP / TCP 192.168.1.2:sti_envision > 68.206.150.243:57322 A
0383 Ether / IP / UDP 190.44.165.86:57549 > 192.168.1.2:35990 / Raw
0384 Ether / IP / UDP 192.168.1.2:35990 > 190.44.165.86:57549 / Raw
0385 Ether / IP / UDP 192.168.1.2:35990 > 129.11.125.169:27256 / Raw
0386 Ether / IP / UDP 192.168.1.2:35990 > 69.192.67.152:18453 / Raw
0387 Ether / IP / UDP 129.11.125.169:27256 > 192.168.1.2:35990 / Raw
0388 Ether / IP / UDP 192.168.1.2:35990 > 66.67.61.44:58546 / Raw
0389 Ether / IP / UDP / DNS Qry "esr2.sheffield3.broadband.bt.net." 
0390 Ether / IP / UDP / DNS Qry "Torik16-TR1-82-128-194-105.suomi.net." 
0391 Ether / IP / UDP / DNS Qry "Torik16R1.opoy.net." 
0392 Ether / IP / UDP / DNS Ans "217.47.73.141" 
0393 Ether / IP / UDP / DNS Ans "82.128.194.105" 
0394 Ether / IP / UDP / DNS Ans "212.50.132.237" 
0395 Ether / IP / UDP / DNS Qry "ui.skype.com." 
0396 Ether / IP / UDP / DNS Qry "ui.skype.com." 
0397 Ether / IP / UDP 69.192.67.152:18453 > 192.168.1.2:35990 / Raw
0398 Ether / IP / UDP 192.168.1.2:35990 > 24.61.5.13:35466 / Raw
0399 Ether / IP / UDP / DNS Ans "212.72.49.131" 
0400 Ether / IP / TCP 192.168.1.2:ep_nsp > 212.72.49.131:http S
0401 Ether / IP / UDP 66.67.61.44:58546 > 192.168.1.2:35990 / Raw
0402 Ether / IP / UDP 192.168.1.2:35990 > 24.107.221.82:55335 / Raw
0403 Ether / IP / TCP 212.72.49.131:http > 192.168.1.2:ep_nsp SA
0404 Ether / IP / TCP 192.168.1.2:ep_nsp > 212.72.49.131:http A
0405 Ether / IP / TCP 192.168.1.2:ep_nsp > 212.72.49.131:http PA / IRCDetector / Raw
0406 Ether / IP / TCP 212.72.49.131:http > 192.168.1.2:ep_nsp A
0407 Ether / IP / TCP 212.72.49.131:http > 192.168.1.2:ep_nsp PA / IRCDetector / Raw
0408 Ether / IP / TCP 192.168.1.2:ep_nsp > 212.72.49.131:http A
0409 Ether / IP / TCP 212.72.49.131:http > 192.168.1.2:ep_nsp FA
0410 Ether / IP / TCP 192.168.1.2:ep_nsp > 212.72.49.131:http FA
0411 Ether / IP / UDP 190.44.165.86:57549 > 192.168.1.2:35990 / Raw
0412 Ether / IP / UDP 192.168.1.2:35990 > 190.44.165.86:57549 / Raw
0413 Ether / IP / UDP 24.61.5.13:35466 > 192.168.1.2:35990 / Raw
0414 Ether / IP / UDP 192.168.1.2:35990 > 72.145.3.159:odeumservlink / Raw
0415 Ether / IP / TCP 212.72.49.131:http > 192.168.1.2:ep_nsp A
0416 Ether / IP / UDP 24.107.221.82:55335 > 192.168.1.2:35990 / Raw
0417 Ether / IP / UDP 192.168.1.2:35990 > 212.149.248.49:62738 / Raw
0418 Ether / IP / UDP 72.145.3.159:odeumservlink > 192.168.1.2:35990 / Raw
0419 Ether / IP / UDP 190.44.165.86:57549 > 192.168.1.2:35990 / Raw
0420 Ether / IP / UDP / DNS Qry "141.8.215.195.in-addr.arpa." 
0421 Ether / IP / UDP / DNS Qry "206.171.147.83.in-addr.arpa." 
0422 Ether / IP / UDP / DNS Qry "217.190.207.172.in-addr.arpa." 
0423 Ether / IP / UDP / DNS Qry "86.165.44.190.in-addr.arpa." 
0424 Ether / IP / UDP / DNS Qry "168.238.130.83.in-addr.arpa." 
0425 Ether / IP / UDP / DNS Qry "219.146.5.83.in-addr.arpa." 
0426 Ether / IP / UDP / DNS Qry "244.163.253.82.in-addr.arpa." 
0427 Ether / IP / UDP / DNS Qry "147.177.139.202.in-addr.arpa." 
0428 Ether / IP / UDP / DNS Qry "123.205.232.202.in-addr.arpa." 
0429 Ether / IP / UDP / DNS Qry "31.145.244.130.in-addr.arpa." 
0430 Ether / IP / UDP / DNS Qry "30.73.47.217.in-addr.arpa." 
0431 Ether / IP / UDP / DNS Qry "21.176.41.217.in-addr.arpa." 
0432 Ether / IP / UDP / DNS Qry "118.176.41.217.in-addr.arpa." 
0433 Ether / IP / UDP / DNS Qry "142.49.72.212.in-addr.arpa." 
0434 Ether / IP / UDP / DNS Qry "49.248.149.212.in-addr.arpa." 
0435 Ether / IP / UDP / DNS Qry "125.60.190.67.in-addr.arpa." 
0436 Ether / IP / UDP / DNS Qry "92.109.242.24.in-addr.arpa." 
0437 Ether / IP / UDP / DNS Qry "169.125.11.129.in-addr.arpa." 
0438 Ether / IP / UDP / DNS Qry "152.67.192.69.in-addr.arpa." 
0439 Ether / IP / UDP / DNS Qry "44.61.67.66.in-addr.arpa." 
0440 Ether / IP / UDP / DNS Qry "13.5.61.24.in-addr.arpa." 
0441 Ether / IP / UDP / DNS Qry "82.221.107.24.in-addr.arpa." 
0442 Ether / IP / UDP / DNS Qry "159.3.145.72.in-addr.arpa." 
0443 Ether / IP / UDP / DNS Ans 
0444 Ether / IP / UDP 192.168.1.2:60589 > 217.41.176.118:33435 / Raw
0445 Ether / IP / UDP / DNS Ans "ip-83-147-171-206.lmk.metro.digiweb.ie." 
0446 Ether / IP / UDP / DNS Ans "lns-bzn-30-82-253-163-244.adsl.proxad.net." 
0447 Ether / IP / UDP / DNS Ans 
0448 Ether / IP / UDP / DNS Ans 
0449 Ether / IP / UDP / DNS Ans "ACCFBED9.ipt.aol.com." 
0450 Ether / IP / UDP / DNS Ans "aapm219.neoplus.adsl.tpnet.pl." 
0451 Ether / IP / UDP / DNS Ans 
0452 Ether / IP / UDP / DNS Ans 
0453 Ether / IP / UDP / DNS Ans "IGLD-83-130-238-168.inter.net.il." 
0454 Ether / IP / UDP / DNS Ans 
0455 Ether / IP / UDP / DNS Ans 
0456 Ether / IP / UDP / DNS Ans "cpe-24-242-109-92.sport.res.rr.com." 
0457 Ether / IP / UDP / DNS Ans "c-67-190-60-125.hsd1.co.comcast.net." 
0458 Ether / IP / UDP / DNS Ans "b-248-49.dsl.kpy.customers.dnainternet.fi." 
0459 Ether / IP / UDP / DNS Ans "cpe-66-67-61-44.rochester.res.rr.com." 
0460 Ether / IP / UDP / DNS Ans 
0461 Ether / IP / UDP / DNS Ans "student-halls-boddington-pc125-169.leeds.ac.uk." 
0462 Ether / IP / UDP / DNS Ans "CPE0016ec35ac27-CM00159a41912e.cpe.net.cable.rogers.com." 
0463 Ether / IP / UDP / DNS Ans "c-24-61-5-13.hsd1.ma.comcast.net." 
0464 Ether / IP / UDP / DNS Ans "adsl-145-3-159.mia.bellsouth.net." 
0465 Ether / IP / UDP / DNS Qry "ip-83-147-171-206.lmk.metro.digiweb.ie." 
0466 Ether / IP / UDP / DNS Qry "lns-bzn-30-82-253-163-244.adsl.proxad.net." 
0467 Ether / IP / UDP / DNS Qry "ACCFBED9.ipt.aol.com." 
0468 Ether / IP / UDP / DNS Qry "aapm219.neoplus.adsl.tpnet.pl." 
0469 Ether / IP / UDP / DNS Qry "IGLD-83-130-238-168.inter.net.il." 
0470 Ether / IP / UDP / DNS Qry "cpe-24-242-109-92.sport.res.rr.com." 
0471 Ether / IP / UDP / DNS Qry "c-67-190-60-125.hsd1.co.comcast.net." 
0472 Ether / IP / UDP / DNS Qry "b-248-49.dsl.kpy.customers.dnainternet.fi." 
0473 Ether / IP / UDP / DNS Qry "cpe-66-67-61-44.rochester.res.rr.com." 
0474 Ether / IP / UDP / DNS Qry "student-halls-boddington-pc125-169.leeds.ac.uk." 
0475 Ether / IP / UDP / DNS Qry "CPE0016ec35ac27-CM00159a41912e.cpe.net.cable.rogers.com." 
0476 Ether / IP / UDP / DNS Qry "c-24-61-5-13.hsd1.ma.comcast.net." 
0477 Ether / IP / UDP / DNS Qry "adsl-145-3-159.mia.bellsouth.net." 
0478 Ether / IP / UDP / DNS Ans "83.147.171.206" 
0479 Ether / IP / UDP / DNS Ans "82.253.163.244" 
0480 Ether / IP / UDP / DNS Ans "172.207.190.217" 
0481 Ether / IP / UDP / DNS Ans "83.5.146.219" 
0482 Ether / IP / UDP / DNS Ans "83.130.238.168" 
0483 Ether / IP / UDP / DNS Ans "24.242.109.92" 
0484 Ether / IP / UDP / DNS Ans "67.190.60.125" 
0485 Ether / IP / UDP / DNS Ans "212.149.248.49" 
0486 Ether / IP / UDP / DNS Qry "ui.skype.com." 
0487 Ether / IP / UDP / DNS Ans "66.67.61.44" 
0488 Ether / IP / UDP / DNS Ans "129.11.125.169" 
0489 Ether / IP / UDP / DNS Ans "69.192.67.152" 
0490 Ether / IP / UDP / DNS Ans "24.61.5.13" 
0491 Ether / IP / UDP / DNS Ans "72.145.3.159" 
0492 Ether / IP / UDP / DNS Ans "24-107-221-82.dhcp.stls.mo.charter.com." 
0493 Ether / IP / UDP 192.168.1.2:35990 > 212.149.248.49:62738 / Raw
0494 Ether / IP / UDP / DNS Ans "bmdj7123.bmobile.ne.jp." 
0495 Ether / IP / UDP 192.168.1.2:35990 > 212.149.248.49:62738 / Raw
0496 Ether / IP / UDP / DNS Qry "24-107-221-82.dhcp.stls.mo.charter.com." 
0497 Ether / IP / UDP / DNS Qry "bmdj7123.bmobile.ne.jp." 
0498 Ether / IP / UDP / DNS Ans "24.107.221.82" 
0499 Ether / IP / UDP / DNS Ans "202.232.205.123" 
0500 Ether / IP / UDP / DNS Ans 
0501 Ether / IP / UDP / DNS Qry "ui.skype.com." 
0502 Ether / IP / UDP / DNS Ans 
0503 Ether / IP / TCP 24.177.122.79:oa_system > 192.168.1.2:asap_tcp PA / IRCDetector / Raw
0504 Ether / IP / TCP 192.168.1.2:asap_tcp > 24.177.122.79:oa_system A
0505 Ether / IP / TCP 172.200.160.242:11352 > 192.168.1.2:4984 PA / Raw
0506 Ether / IP / TCP 192.168.1.2:4984 > 172.200.160.242:11352 A
0507 Ether / IP / UDP 192.168.1.2:60592 > 217.41.176.118:33435 / Raw
0508 Ether / IP / UDP / DNS Qry "ui.skype.com." 
0509 Ether / IP / UDP / DNS Ans 
0510 Ether / IP / UDP / DNS Qry "ui.skype.com." 
0511 Ether / IP / UDP / DNS Ans 
0512 Ether / IP / UDP 192.168.1.2:35990 > 212.149.248.49:62738 / Raw
0513 Ether / IP / TCP 192.168.1.2:amt_blc_port > 212.204.214.114:6667 PA / IRCDetector / IRC
0514 Ether / IP / TCP 212.204.214.114:6667 > 192.168.1.2:amt_blc_port PA / IRCDetector / IRC
0515 Ether / IP / TCP 192.168.1.2:amt_blc_port > 212.204.214.114:6667 A
0516 Ether / IP / UDP 192.168.1.2:35990 > 212.149.248.49:62738 / Raw
0517 Ether / IP / UDP 192.168.1.2:60595 > 217.41.176.118:33435 / Raw
0518 Ether / IP / TCP 71.10.179.129:14232 > 192.168.1.2:as_debug PA / Raw
0519 Ether / IP / TCP 192.168.1.2:as_debug > 71.10.179.129:14232 A
0520 Ether / IP / TCP 212.204.214.114:6667 > 192.168.1.2:amt_blc_port PA / IRCDetector / IRC
0521 Ether / IP / TCP 192.168.1.2:amt_blc_port > 212.204.214.114:6667 A
0522 Ether / IP / TCP 193.150.239.120:11421 > 192.168.1.2:teredo PA / Raw
0523 Ether / IP / TCP 192.168.1.2:teredo > 193.150.239.120:11421 A
0524 Ether / IP / UDP / DNS Qry "120.239.150.193.in-addr.arpa." 
0525 Ether / IP / UDP / DNS Ans "c193-150-239-120.cm-upc.chello.se." 
0526 Ether / IP / UDP / DNS Qry "c193-150-239-120.cm-upc.chello.se." 
0527 Ether / IP / UDP / DNS Ans "193.150.239.120" 
0528 Ether / IP / UDP 192.168.1.2:35990 > 24.107.221.82:55335 / Raw
0529 Ether / IP / UDP 24.107.221.82:55335 > 192.168.1.2:35990 / Raw
0530 Ether / IP / UDP 192.168.1.2:35990 > 68.84.140.103:47070 / Raw
0531 Ether / IP / UDP 192.168.1.2:35990 > 72.181.61.199:7150 / Raw
0532 Ether / IP / UDP 192.168.1.2:35990 > 24.225.155.47:53311 / Raw
0533 Ether / IP / UDP 24.225.155.47:53311 > 192.168.1.2:35990 / Raw
0534 Ether / IP / UDP 68.84.140.103:47070 > 192.168.1.2:35990 / Raw
0535 Ether / IP / UDP 192.168.1.2:35990 > 82.216.129.118:39085 / Raw
0536 Ether / IP / UDP 192.168.1.2:35990 > 24.243.179.113:56792 / Raw
0537 Ether / IP / UDP 72.181.61.199:7150 > 192.168.1.2:35990 / Raw
0538 Ether / IP / UDP 192.168.1.2:35990 > 67.162.133.209:56626 / Raw
0539 Ether / IP / UDP 82.216.129.118:39085 > 192.168.1.2:35990 / Raw
0540 Ether / IP / UDP 192.168.1.2:35990 > 212.30.7.170:30241 / Raw
0541 Ether / IP / UDP 212.30.7.170:30241 > 192.168.1.2:35990 / Raw
0542 Ether / IP / UDP 67.162.133.209:56626 > 192.168.1.2:35990 / Raw
0543 Ether / IP / UDP 24.243.179.113:56792 > 192.168.1.2:35990 / Raw
0544 Ether / IP / UDP 192.168.1.2:35990 > 67.162.133.209:56626 / Raw
0545 Ether / IP / UDP 192.168.1.2:35990 > 82.216.129.118:39085 / Raw
0546 Ether / IP / UDP 192.168.1.2:35990 > 72.181.61.199:7150 / Raw
0547 Ether / IP / UDP 192.168.1.2:35990 > 68.84.140.103:47070 / Raw
0548 Ether / IP / UDP 192.168.1.2:35990 > 24.107.221.82:55335 / Raw
0549 Ether / IP / UDP 192.168.1.2:35990 > 66.67.61.44:58546 / Raw
0550 Ether / IP / UDP 192.168.1.2:35990 > 24.242.109.92:44872 / Raw
0551 Ether / IP / UDP 192.168.1.2:35990 > 67.190.60.125:sops / Raw
0552 Ether / IP / UDP 82.216.129.118:39085 > 192.168.1.2:35990 / Raw / Padding
0553 Ether / IP / UDP 67.162.133.209:56626 > 192.168.1.2:35990 / Raw / Padding
0554 Ether / IP / UDP 68.84.140.103:47070 > 192.168.1.2:35990 / Raw / Padding
0555 Ether / IP / UDP 24.107.221.82:55335 > 192.168.1.2:35990 / Raw / Padding
0556 Ether / IP / UDP 72.181.61.199:7150 > 192.168.1.2:35990 / Raw / Padding
